AREA_NM,New_ADDR,Old_ADDR,lat,lng
큰사슴이오름,제주특별자치도 서귀포시 표선면 중산간동로,제주 서귀포시 표선면 가시리 산68,,
클럽나인브릿지,제주특별자치도 서귀포시 안덕면 광평로 34-156,제주특별자치도 서귀포시 안덕면 광평리 산15,33.3403726,126.4042502
키아나 요가,제주특별자치도 서귀포시 안덕면 사계남로50번길 1,제주특별자치도 서귀포시 안덕면 사계리 2347-1,33.2271856,126.2956485
타오하우스,제주특별자치도 제주시 도두봉6길 9-1,제주특별자치도 제주시 도두일동 1700-8,33.5082517,126.4723689
탐나라공화국(제주남이섬),제주특별자치도 제주시 한림읍 한창로 897,제주특별자치도 제주시 한림읍 금악리 81-8,33.3345115,126.3256922
탐라승마장,제주특별자치도 제주시 조천읍 비자림로 1044,제주특별자치도 제주시 조천읍 교래리 42-3,33.4330322,126.7169426
탑동,제주특별자치도 제주시 중앙로 2,제주특별자치도 제주시 삼도이동 1262,33.5179236,126.5242565
탑동해변공연장,제주특별자치도 제주시 중앙로 2,제주특별자치도 제주시 삼도이동 1262,33.5179236,126.5242565
태웃개,제주특별자치도 서귀포시 남원읍 태위로398번길 57,제주특별자치도 서귀포시 남원읍 위미리 70-1,33.2706577,126.6909318
태흥포구,제주특별자치도 서귀포시 남원읍 태흥리,제주특별자치도 서귀포시 남원읍 태흥리,33.293,126.7429
터진목 & 성산면 4·3희생자 위령비,제주특별자치도 서귀포시 성산읍 일출로 88-19,제주특별자치도 서귀포시 성산읍 고성리 224-1,33.4499536,126.9223359
테디베어뮤지엄제주,제주특별자치도 서귀포시 중문관광로110번길 31,제주특별자치도 서귀포시 색달동 2889,33.2503670,126.4121620
테디베어사파리 테지움,제주특별자치도 제주시 애월읍 평화로 2159,제주특별자치도 제주시 애월읍 소길리 155-106,33.4121614,126.3936509
테우마을 수원리 농어촌체험마을,제주시 한림읍 한림해안로 274,제주특별자치도 제주시 한림읍 수원리 725-1,33.4255801,126.2645913
텐타임즈,제주특별자치도 서귀포시 이어도로 826-51,제주특별자치도 서귀포시 강정동 750,33.2324473,126.5001906
토끼섬,제주특별자치도 제주시 구좌읍 하도리,제주특별자치도 제주시 구좌읍 하도리,33.514383,126.886425
토산봉(망오름),제주특별자치도 서귀포시 표선면 토산리 산 13,제주특별자치도 서귀포시 표선면 토산리 산 13,33.3224749,126.7737252
토이레저,제주특별자치도 서귀포시 안덕면 동광로 267-7,제주특별자치도 서귀포시 안덕면 동광리 383,33.3189781,126.3453633
토이승마장,제주특별자치도 서귀포시 안덕면 동광로 265-14,제주특별자치도 서귀포시 안덕면 동광리 897-2,33.3182965,126.3451270
토이파크,제주특별자치도 서귀포시 안덕면 동광로 267-7,제주특별자치도 서귀포시 안덕면 동광리 383,33.3189781,126.3453633
토종닭유통특구교래삼다수마을,제주특별자치도 제주시 조천읍 교래리,제주특별자치도 제주시 조천읍 교래리,33.431457,126.676582
톨칸이,제주특별자치도 제주시 우도면 연평리 1732-1,제주특별자치도 제주시 우도면 연평리 1732-1,33.4920227,126.9544525
통오름,제주특별자치도 서귀포시 성산읍 신산리 1754-1,제주특별자치도 서귀포시 성산읍 신산리 1754-1,33.3923293,126.8542006
통일관,제주특별자치도 제주시 삼성로 46,제주특별자치도 제주시 일도이동 968-2,33.5067314,126.5308110
튼튼동물병원,제주특별자치도 제주시 중앙로 351,제주특별자치도 제주시 이도이동 1987-14,33.4905642,126.5380155
팀케이,제주특별자치도 제주시 고사마루길 67-4,제주특별자치도 제주시 노형동 2239-1,33.4753141,126.4730085
파군봉(바굼지오름),제주특별자치도 제주시 애월읍 하귀1리 688-1,제주특별자치도 제주시 애월읍 하귀1리 688-1,33.4790724,126.4123019
파더스가든,제주특별자치도 서귀포시 안덕면 병악로 44-33,제주특별자치도 서귀포시 안덕면 상창리 804,33.2801127,126.3647296
파인더웨이브,제주특별자치도 제주시 애월읍 일주서로 6079,제주특별자치도 제주시 애월읍 곽지리 1549-1,33.4534518,126.3086970
파파빌레,제주특별자치도 제주시 조천읍 남조로 2185,제주특별자치도 제주시 조천읍 와흘리 165-8,33.4605019,126.6611099
"판포오름 (널개오름, 板浦岳)",제주특별자치도 제주시 한경면 판포리 934,제주특별자치도 제주시 한경면 판포리 934,33.3578707,126.2125257
판포포구,제주특별자치도 제주시 한경면 판포리 2877-3,제주특별자치도 제주시 한경면 판포리 2877-3,33.3654080,126.1996046
퍼시픽 마리나 요트투어,제주특별자치도 서귀포시 중문관광로 154-17,제주특별자치도 서귀포시 색달동 2950-17,33.2450404,126.4155991
퍼피홀릭,제주특별자치도 제주시 승천로 81,제주특별자치도 제주시 아라이동 3003-10,33.4918437,126.5435433
펫소풍,제주특별자치도 서귀포시 안덕면 화순서서로 458,제주특별자치도 서귀포시 안덕면 서광리 2188-1,33.2827826,126.3048302
펫플러스,제주특별자치도 제주시 신광로 52,제주특별자치도 제주시 연동 262-4,33.4874325,126.4896166
편백포레스트,제주특별자치도 서귀포시 남원읍 서성로 544-97,제주특별자치도 서귀포시 남원읍 한남리 산18,33.3174795,126.6596901
평대리불턱,제주특별자치도 제주시 구좌읍 해맞이해안로 1240-3,제주특별자치도 제주시 구좌읍 평대리 515-67,33.5324704,126.8462648
평대리해변,제주특별자치도 제주시 구좌읍 평대리 515-24,제주특별자치도 제주시 구좌읍 평대리 515-24,33.5323131,126.8480380
평대해변,제주특별자치도 제주시 구좌읍 평대리 1994-20,제주특별자치도 제주시 구좌읍 평대리 1994-20,33.5332099,126.8405828
평수포구,제주특별자치도 제주시 한림읍 한림해안로 297-1,제주특별자치도 제주시 한림읍 수원리 952,33.4276303,126.2636330
평화통일 불사리탑,제주특별자치도 제주시 조천읍 일주동로 884,제주특별자치도 제주시 조천읍 조천리 2268-1,33.5314999,126.6368868
포레스트 사파리,제주특별자치도 제주시 조천읍 선교로 474-1,제주특별자치도 제주시 조천읍 선흘리 1817,33.4630625,126.7095693
포브독,제주특별자치도 제주시 연북로 74,제주특별자치도 제주시 연동 1371-3,33.4815318,126.4891752
포토갤러리 자연사랑미술관,제주특별자치도 서귀포시 표선면 가시리 1920-1,제주특별자치도 서귀포시 표선면 가시리 1920-1,33.3546800,126.7720871
표선세화해안도로,제주특별자치도 서귀포시 표선면 표선리,제주특별자치도 서귀포시 표선면 표선리,33.324017,126.82795
표선해수욕장,제주특별자치도 서귀포시 표선면 표선리,제주특별자치도 서귀포시 표선면 표선리,33.324017,126.82795
푸른콩 방주영농조합법인,제주특별자치도 서귀포시 중산간서로 740(중문동),제주특별자치도 서귀포시 중문동 1226,33.2632439,126.4361259
풋감마을 소길리 농어촌체험마을,제주시 애월읍 소길1길 15,제주특별자치도 제주시 애월읍 소길리 650-1,33.4400527,126.3798773
퓸퓸몽,제주특별자치도 제주시 신설로2길 5-17,제주특별자치도 제주시 이도이동 1970-6,33.4954834,126.5425446
플레이박스VR,제주특별자치도 제주시 은수길 69,제주특별자치도 제주시 연동 1320,33.4706602,126.4879244
피규어뮤지엄 제주,제주특별자치도 서귀포시 안덕면 한창로 243,제주특별자치도 서귀포시 안덕면 상창리 1875-8,33.2818686,126.3552564
피크닉메이트,제주특별자치도 제주시 아란4길 84,제주특별자치도 제주시 아라일동 6061-5,33.4701665,126.5415060
핀크스 골프클럽,제주특별자치도 서귀포시 안덕면 산록남로 863,제주특별자치도 서귀포시 안덕면 상천리 산62-3,33.3153157,126.3885723
필코 스튜디오,제주특별자치도 제주시 한경면 저지12길 62-5 (저지리),제주특별자치도 제주시 한경면 저지리 3265-6,33.3383421,126.2631157
하고수동해변,제주특별자치도 제주시 우도면 연평리,제주특별자치도 제주시 우도면 연평리,33.5075,126.9549
하논마르,제주특별자치도 서귀포시 서홍동 1003,제주특별자치도 서귀포시 서홍동 1003,33.2529498,126.5457349
하도 어촌 체험 마을,제주특별자치도 제주시 구좌읍 해맞이해안로 1897-27,제주특별자치도 제주시 구좌읍 하도리 22-10,33.5200328,126.9040561
하도리 철새도래지,제주특별자치도 제주시 구좌읍 하도리 53-2,제주특별자치도 제주시 구좌읍 하도리 53-2,33.5104154,126.8963126
하도어촌체험마을,제주특별자치도 제주시 구좌읍 해맞이해안로 1897-27,제주특별자치도 제주시 구좌읍 하도리 22-10,33.5200328,126.9040561
하도해변,제주특별자치도 제주시 구좌읍 해맞이해안로,제주 제주시 구좌읍 하도리,,
하례감귤점빵협동조합,제주특별자치도 서귀포시 남원읍 하례로 272,제주특별자치도 서귀포시 남원읍 하례리 738-12,33.2713433,126.6233403
하례점빵,제주특별자치도 서귀포시 남원읍 하례로 272,제주특별자치도 서귀포시 남원읍 하례리 738-12,33.2713433,126.6233403
하멜기념비,제주특별자치도 서귀포시 안덕면 사계리 112-3,제주특별자치도 서귀포시 안덕면 사계리 112-3,33.2334804,126.3146170
하모돌고래투어,제주특별자치도 서귀포시 대정읍 최남단해안로 120,제주특별자치도 서귀포시 대정읍 하모리 646-20,33.2100651,126.2583797
하예포구(예래포구),제주특별자치도 서귀포시 하예동,제주특별자치도 서귀포시 하예동,33.2394,126.3804
하효살롱 협동조합,제주특별자치도 서귀포시 효돈순환로 217-8,제주특별자치도 서귀포시 하효동 967-1,33.2565184,126.6217423
한국건강관리협회제주특별자치도부,제주특별자치도 제주시 연북로 111,제주특별자치도 제주시 연동 1375,33.4820781,126.4933151
한국병원,제주특별자치도 제주시 서광로 193,제주특별자치도 제주시 삼도일동 518,33.5002330,126.5170620
한국야구명예전당(야구박물관),제주특별자치도 서귀포시 중산간서로 97-1,제주특별자치도 서귀포시 강정동 1481-3,33.2605483,126.4985254
한남의숙터,제주특별자치도 서귀포시 대정읍 추사로,제주특별자치도 서귀포시 대정읍 안성리,,
한담해변,제주특별자치도 제주시 애월읍 애월로1길 26-4,제주특별자치도 제주시 애월읍 애월리 2533-1,33.4627538,126.3100966
한동환해장성,제주특별자치도 제주시 구좌읍 해맞이해안로 858-1,제주특별자치도 제주시 구좌읍 행원리 106,33.5515891,126.8273540
한라동물종합병원,제주특별자치도 제주시 고마로 37,제주특별자치도 제주시 일도이동 321-10,33.5108672,126.5390471
한라산 아래 첫 마을,제주특별자치도 서귀포시 안덕면 광평로 41,제주특별자치도 서귀포시 안덕면 광평리 195-2,33.3295792,126.3812297
한라산국립공원,제주특별자치도 제주시 1100로 2070-61,제주특별자치도 제주시 해안동 산220-13,33.3926876,126.4948419
한라산소주공장,제주특별자치도 제주시 한림읍 한림로 555,제주특별자치도 제주시 한림읍 옹포리 396,33.4077661,126.2561229
한라산어리목코스,제주특별자치도 제주시 1100로 2070-61,제주특별자치도 제주시 해안동 산220-13,33.3926876,126.4948419
한라산영실코스,제주특별자치도 서귀포시 영실로 246,제주특별자치도 서귀포시 하원동 산1-1,33.3401088,126.4805166
한라생태숲,제주특별자치도 제주시 516로 2596,제주특별자치도 제주시 용강동 산14-1,33.4310909,126.6005344
한라수목원,제주특별자치도 제주시 수목원길 72,제주특별자치도 제주시 연동 1012,33.4697410,126.4921380
한라승마장,제주특별자치도 서귀포시 안덕면 평화로 1078,제주특별자치도 서귀포시 안덕면 동광리 산32-2,33.3248074,126.3527368
한라의향기,제주특별자치도 서귀포시 안덕면 병악로 58,제주특별자치도 서귀포시 안덕면 상창리 840,33.2811531,126.3638074
한림공원,제주특별자치도 제주시 한림읍 한림로 300(협재리),제주특별자치도 제주시 한림읍 협재리 2487,33.3902130,126.2397047
한림동물병원,제주특별자치도 제주시 한림읍 한림상로 114,제주특별자치도 제주시 한림읍 동명리 1597-7,33.4096373,126.2651262
한림바다체험마을,제주특별자치도 제주시 한림읍 한림해안로 200,제주특별자치도 제주시 한림읍 한수리 879-30,33.4197728,126.2627723
한림항,제주특별자치도 제주시 한림읍 한림해안로 192,제주특별자치도 제주시 한림읍 대림리 2019-17,33.4190627,126.2625620
한림해안도로,제주특별자치도 제주시 한림읍 귀덕리,제주특별자치도 제주시 한림읍 귀덕리,33.430793,126.291425
한모살 (표선백사장),제주특별자치도 제주시 표선면 표선리,제주특별자치도 제주시 표선면 표선리,,
한형수정원,제주특별자치도 제주시 한림읍 옹포2길 44,제주특별자치도 제주시 한림읍 협재리 1352,33.3969554,126.2498365
한화리조트 테라피센터,제주특별자치도 제주시 명림로 575-107 한화리조트 로비층 지하,제주특별자치도 제주시 회천동 3-16,33.4488639,126.6375149
함덕백사장 & 서우봉,제주특별자치도 제주시 조천읍 조함해안로 519-10,제주특별자치도 제주시 조천읍 함덕리 1008-1,33.5437098,126.6687041
함덕스쿠버,제주특별자치도 제주시 조천읍 조함해안로 376-11,제주특별자치도 제주시 조천읍 함덕리 3297,33.5472654,126.6570009
함덕야영장,제주특별자치도 제주시 조천읍 함덕리 1008,제주특별자치도 제주시 조천읍 함덕리 1008,33.5440210,126.6682567
함덕잠수함(이고제주),제주특별자치도 제주시 조천읍 조함해안로 378,제주특별자치도 제주시 조천읍 함덕리 3294,33.5477953,126.6568189
함덕카페거리,제주특별자치도 제주시 조천읍 함덕리,제주특별자치도 제주시 조천읍 함덕리,33.534575,126.66015
함덕해수욕장,제주특별자치도 제주시 조천읍 조함해안로 525,제주특별자치도 제주시 조천읍 함덕리 1004-10,33.5427890,126.6705232
항파두리항몽유적지,제주특별자치도 제주시 애월읍 항파두리로 50,제주특별자치도 제주시 애월읍 상귀리 1012,33.4532024,126.4076561
해거름전망대,제주특별자치도 제주시 한경면 일주서로 4641,제주특별자치도 제주시 한경면 판포리 1462-2,33.3712812,126.2072623
해녀박물관,제주특별자치도 제주시 구좌읍 해녀박물관길 26,제주특별자치도 제주시 구좌읍 상도리 3204-1,33.5235990,126.8633984
해녀의 태왁,제주특별자치도 제주시 구좌읍 김송로 94,제주특별자치도 제주시 구좌읍 김녕리 904-4,33.5429296,126.7545546
해맑은동물병원,제주특별자치도 제주시 한라대학로 75,제주특별자치도 제주시 노형동 759,33.4765157,126.4783677
해맞이해안로,제주특별자치도 제주시 구좌읍 김녕리,제주특별자치도 제주시 구좌읍 김녕리,33.550392,126.742713
해비치컨트리클럽제주,제주특별자치도 서귀포시 남원읍 원님로 399번길 319,제주특별자치도 서귀포시 남원읍 신흥리 산30,33.3623095,126.7218982
해빛,제주특별자치도 제주시 조천읍 신촌9길 8,제주특별자치도 제주시 조천읍 신촌리 1899-1,33.5353318,126.6222250
해빛다이브,제주특별자치도 서귀포시 칠십리로 123,제주특별자치도 서귀포시 서귀동 42,33.2430548,126.5675837
해품은체험농장,제주특별자치도 서귀포시 성산읍 서성일로 1078-14,제주특별자치도 서귀포시 성산읍 수산리 225,33.4433118,126.8926395
해피맘하우스,제주특별자치도 제주시 애월읍 애월해안로 306-3,제주특별자치도 제주시 애월읍 고내리 448-2,33.4703783,126.3422478
해피애견놀이방,제주특별자치도 제주시 오라로1길 20-9,제주특별자치도 제주시 오라삼동 2238-5,33.4979903,126.5079383
핸즈웍스,제주특별자치도 제주시 한림읍 귀덕로 78,제주특별자치도 제주시 한림읍 귀덕리 756,33.4376279,126.2969320
행복공방 에치비,제주특별자치도 서귀포시 중산간서로 188,제주특별자치도 서귀포시 강정동 5628,33.2603879,126.4915896
행원육상양식단지,제주특별자치도 제주시 구좌읍 해맞이해안로 680-13,제주특별자치도 제주시 구좌읍 행원리 1-33,33.5596162,126.8163170
허브동산 미디어 파사드 (media facade),제주특별자치도 서귀포시 표선면 돈오름로 170,제주특별자치도 서귀포시 표선면 표선리 2608,33.3291241,126.8147261
헌마공신 김만일기념관,제주특별자치도 서귀포시 남원읍 서성로 919,제주특별자치도 서귀포시 남원읍 한남리 992,33.3361472,126.6907860
헬로키티아일랜드,제주특별자치도 서귀포시 안덕면 한창로 340,제주특별자치도 서귀포시 안덕면 상창리 1963-2,33.2900995,126.3520811
현사포구,제주특별자치도 제주시 이호1동,제주특별자치도 제주시 이호1동,33.4982,126.4586
현의합장묘역,제주특별자치도 서귀포시 남원읍 중산간동로 6242-56,제주특별자치도 서귀포시 남원읍 수망리 893,33.3277662,126.7016271
협자연대,제주특별자치도 서귀포시 성산읍 고성리 57-1,제주특별자치도 서귀포시 성산읍 고성리 57-1,33.4263444,126.9321389
협재굴(한림공원),제주특별자치도 제주시 한림읍 한림로 300,제주특별자치도 제주시 한림읍 협재리 2487,33.3902130,126.2397047
협재포구,제주특별자치도 제주시 한림읍 협재리,제주특별자치도 제주시 한림읍 협재리,33.3822,126.2498
협재해수욕장,제주특별자치도 제주시 한림읍 한림로 329-10,제주특별자치도 제주시 한림읍 협재리 2447,33.3937480,126.2394319
형제섬,제주특별자치도 서귀포시 안덕면 사계리 산 44,제주특별자치도 서귀포시 안덕면 사계리 산 44,33.2100081,126.3142694
형제해안도로,제주특별자치도 서귀포시 대정읍 상모리 1649-1,제주특별자치도 서귀포시 대정읍 상모리 1649-1,33.2009949,126.2801201
형제해안로전망대,제주특별자치도 서귀포시 안덕면 형제해안로 26,제주특별자치도 서귀포시 안덕면 사계리 2147-13,33.2278631,126.3037263
혼인지,제주특별자치도 서귀포시 성산읍 혼인지로 39-22,제주특별자치도 서귀포시 성산읍 온평리 1702-1,33.4149937,126.8947755
홀리데이 다이빙 코리아,제주특별자치도 서귀포시 칠십리로91번길 25,제주특별자치도 서귀포시 서귀동 688-5,33.2408423,126.5628217
화북비석거리,제주특별자치도 제주시  화북1동 4008,제주특별자치도 제주시  화북1동 4008,33.5212164,126.5599713
화북환해장성,제주특별자치도 제주시 화북동,제주특별자치도 제주시 화북동,33.520399,126.565428
화순곶자왈생태탐방숲길,제주특별자치도 서귀포시 안덕면 화순서동로 151,제주특별자치도 서귀포시 안덕면 화순리 2045-5,33.2634770,126.3323652
화순금모래해수욕장,제주특별자치도 서귀포시 안덕면 화순해안로 91,제주특별자치도 서귀포시 안덕면 화순리 776-7,33.2398451,126.3357776
화순금모래해수욕장담수수영장,제주특별자치도 서귀포시 안덕면 화순리 776-8,제주특별자치도 서귀포시 안덕면 화순리 776-8,33.2395872,126.3356605
화순리 유채꽃길,제주특별자치도 서귀포시 안덕면 화순리 1230-4,제주특별자치도 서귀포시 안덕면 화순리 1230-4,33.2517744,126.3338999
화조원,제주특별자치도 제주시 애월읍 애원로 804,제주특별자치도 제주시 애월읍 납읍리 58,33.4113253,126.3720224
환상숲 곶자왈공원,제주특별자치도 제주시 한경면 녹차분재로 594-1,제주특별자치도 제주시 한경면 저지리 2848-2,33.3226049,126.2632391
환상숲곶자왈 담앙족욕,제주특별자치도 제주시 한경면 녹차분재로 594-1,제주특별자치도 제주시 한경면 저지리 2848-2,33.3226049,126.2632391
황금굴(한림공원),제주특별자치도 제주시 한림읍 한림로 300,제주특별자치도 제주시 한림읍 협재리 2487,33.3902130,126.2397047
황우럭만화천국사회적협동조합,제주특별자치도 제주시 한림읍 내동남길 7-3,제주특별자치도 제주시 한림읍 한림리 1055,33.4142609,126.2665586
황우지해안,제주특별자치도 서귀포시 서홍동 766-1,제주특별자치도 서귀포시 서홍동 766-1,33.2415396,126.5497439
황우지해안 열두굴,제주특별자치도 서귀포시 서홍동 764-1,제주특별자치도 서귀포시 서홍동 764-1,33.2419446,126.5506956
효명사,제주특별자치도 서귀포시 남원읍 516로 815-41,제주특별자치도 서귀포시 남원읍 하례리 산45,33.3233196,126.5941465
후포해변,제주특별자치도 제주시 추자면 대서5길 87,제주특별자치도 제주시 추자면 대서리 267,33.9623394,126.2895689
훈데르트바서파크,제주특별자치도 제주시 우도면 우도해안길 32-12,제주특별자치도 제주시 우도면 연평리 2658,33.4931582,126.9557379
휘닉스 르쏠레이테라피,제주특별자치도 서귀포시 성산읍 섭지코지로 107 휘닉스제주아일랜드리조트 블루동 1층,제주특별자치도 서귀포시 성산읍 고성리 127-2,33.4302921,126.9293643
휴림,제주특별자치도 제주시 애월읍 광령남서길 40,제주특별자치도 제주시 애월읍 광령리 2873,33.4437993,126.4287941
휴애리 자연생활공원,"제주특별자치도 서귀포시 남원읍 신례동로 256 (신례리, 휴애리)",제주특별자치도 서귀포시 남원읍 신례리 2081,33.3085451,126.6344091
흑돼지거리,제주특별자치도 제주시 건입동,제주특별자치도 제주시 건입동,33.515029,126.531543
"그대, 나의 뮤즈 : 클림트 to 마티스",제주특별자치도 서귀포시 안덕면 신화역사로304번길 38 제주신화월드 서머셋클럽하우스,제주특별자치도 서귀포시 안덕면 서광리 산24,33.3053827,126.3173903
바당미술관,제주특별자치도 서귀포시 대정읍 노을해안로 96,제주특별자치도 서귀포시 대정읍 일과리 1924-4,33.2438623,126.2187034
우도보물섬레져,제주특별자치도 제주시 우도면 우도해안길 336,제주특별자치도 제주시 우도면 연평리 2427-3,33.5081590,126.9438206
동검은이오름(거미오름),제주특별자치도 제주시 구좌읍 종달리 산 70,제주특별자치도 제주시 구좌읍 종달리 산 70,33.4487593,126.8053368
백약이오름 [출입제한 - 자연휴식년제 적용 중],제주특별자치도 서귀포시 표선면 성읍리 산 1,제주특별자치도 서귀포시 표선면 성읍리 산 1,33.4372159,126.7901630
솔담현경철한의원,제주특별자치도 제주시 1100로 3055,제주특별자치도 제주시 노형동 241-1,33.4590435,126.4845726
송악산 [출입제한 - 자연휴식년제 적용 중],제주특별자치도 서귀포시 대정읍 송악관광로 421-1,제주특별자치도 서귀포시 대정읍 상모리 131,33.2077573,126.2908794
재밋섬파크,제주특별자치도 제주시 중앙로14길 18,제주특별자치도 제주시 삼도이동 108-13,33.5116016,126.5225566
헌마공신김만일기념관,서귀포시 남원읍 서성로 919,제주특별자치도 서귀포시 남원읍 한남리 992,33.3361472,126.6907860
돝오름(돗오름),제주특별자치도 제주시 구좌읍 송당리 산 3,제주특별자치도 제주시 구좌읍 송당리 산 3,33.4804864,126.7995126
제주러브랜드[휴업중],제주특별자치도 제주시 1100로 2894-72,제주특별자치도 제주시 연동 680-26,33.4518907,126.4888690
직접 내 손으로 채취할 수 있는 해산물이라구 <제주 바릇잡이 할 수 있는 포인트>,제주특별자치도 제주시 구좌읍 해맞이해안로 1897-27,제주특별자치도 제주시 구좌읍 하도리 22-10,33.5200328,126.9040561
큰엉해안경승지,제주특별자치도 서귀포시 남원읍 태위로 522-17,제주특별자치도 서귀포시 남원읍 남원리 2379-3,33.2733537,126.7036975
하멜상선전시관,제주특별자치도 서귀포시 안덕면 사계남로216번길 24-30,제주특별자치도 서귀포시 안덕면 사계리 116-7,33.2333898,126.3137108
한울랜드,제주특별자치도 제주시 구좌읍 동백로 458,제주특별자치도 제주시 구좌읍 덕천리 766,33.4971242,126.7504543
어승생승마장 Horseland Jeju,제주특별자치도 제주시 1100로 2659 (노형동),제주특별자치도 제주시 노형동 산14-1,33.4257598,126.4904093
용눈이오름 [출입제한 - 자연휴식년제 적용 중],제주특별자치도 제주시 구좌읍 종달논길,제주특별자치도 제주시 구좌읍 종달논길,,
