AREA_NM,New_ADDR,Old_ADDR,lat,lng
문화예술마을 저지리 농어촌체험마을,제주특별자치도 제주시 한경면 중산간서로 3675,제주특별자치도 제주시 한경면 저지리 1863-1,33.3326945,126.2558603
"물메(물미, 수산봉)",제주특별자치도 제주시 애월읍 수산리 산 1-1,제주특별자치도 제주시 애월읍 수산리 산 1-1,33.4738089,126.3828222
물뫼힐링팜,제주특별자치도 제주시 애월읍 예원로 51,제주특별자치도 제주시 애월읍 수산리 357-1,33.4642368,126.3965566
물영아리오름,제주특별자치도 서귀포시 남원읍 남조로 988-11,제주특별자치도 서귀포시 남원읍 수망리 산182-2,33.3612712,126.6929622
물찻오름 [출입제한 - 자연휴식년제 적용 중],제주특별자치도 제주시 조천읍 교래길,제주특별자치도 제주시 조천읍 교래길,,
"미악산 (턥오름, 쌀오름, 솔오름)",제주특별자치도 서귀포시 인정오름로 387-63,제주특별자치도 서귀포시 동홍동 산7-1,33.3005646,126.5542079
미요캔들,제주특별자치도 제주시 구남로4길 8-1,제주특별자치도 제주시 이도이동 2036-1,33.4890569,126.5340127
미천굴,제주특별자치도 서귀포시 성산읍 중산간동로 4150-30,제주특별자치도 서귀포시 성산읍 삼달리 1010,33.3832875,126.8415364
민속자연사박물관,제주특별자치도 제주시 삼성로 40,제주특별자치도 제주시 일도이동 996-1,33.5063920,126.5313380
민속해안로,제주특별자치도 서귀포시 표선면 일주동로 6228,제주특별자치도 서귀포시 표선면 세화리 281-1,33.3072495,126.8062270
민오름(구좌읍),제주특별자치도 제주시 구좌읍 비자림로 1456,제주특별자치도 제주시 구좌읍 송당리 2438,33.4447500,126.7591021
민오름(봉개동),제주특별자치도 제주시 칠오름길 (봉개동),제주특별자치도 제주시 칠오름길 (봉개동),,
민오름(오라동),제주특별자치도 제주시 오라2동 산 12,제주특별자치도 제주시 오라2동 산 12,33.4765134,126.5064301
민오름(조천읍),제주특별자치도 제주시 조천읍 선흘리 산 141,제주특별자치도 제주시 조천읍 선흘리 산 141,33.4478821,126.6917987
바구스서핑스쿨,제주특별자치도 제주시 테우해안로 143,제주특별자치도 제주시 이호일동 1788-6,33.4975070,126.4495833
바늘오름,제주특별자치도 제주시 조천읍 교래리 산 108,제주특별자치도 제주시 조천읍 교래리 산 108,33.4544904,126.6528120
바다다이브,제주특별자치도 서귀포시 동홍로12번길 5,제주특별자치도 서귀포시 서귀동 253-10,33.2498096,126.5684826
바람모루,제주특별자치도 서귀포시 서호동,제주특별자치도 서귀포시 서호동,33.28775,126.517488
바람불어좋은날 천연염색 공방,제주특별자치도 서귀포시 안덕면 사계로 68,제주특별자치도 서귀포시 안덕면 사계리 2982-1,33.2371215,126.2978841
바릇스파,제주특별자치도 제주시 한림읍 한림로 392 3층,제주특별자치도 제주시 한림읍 협재리 1607,33.3970461,126.2444043
바이나흐튼 크리스마스 박물관,제주특별자치도 서귀포시 안덕면 평화로 654,제주특별자치도 서귀포시 안덕면 서광리 456,33.2913123,126.3278107
박물관은 살아있다,제주특별자치도 서귀포시 중문관광로 42,제주특별자치도 서귀포시 색달동 2629,33.2548060,126.4089300
박성내,제주특별자치도 제주시 기자길 5,제주특별자치도 제주시 아라이동 1370-6,33.4848738,126.5438393
박수기정,제주특별자치도 서귀포시 안덕면 난드르로 90-25,제주특별자치도 서귀포시 안덕면 감산리 1010,33.2371552,126.3587422
반지마을 제주 1호점,제주특별자치도 제주시 월성로4길 17 3,제주특별자치도 제주시 용담이동 2761-1,33.5016782,126.5035779
발이오름,제주특별자치도 제주시 애월읍 어음리 산 1,제주특별자치도 제주시 애월읍 어음리 산 1,33.3930042,126.3752595
발자국화석공원,제주특별자치도 서귀포시 대정읍 형제해안로 192,제주특별자치도 서귀포시 대정읍 상모리 626-1,33.2173564,126.2931377
밧돌오름,제주특별자치도 제주시 구좌읍 송당리 산 66-1,제주특별자치도 제주시 구좌읍 송당리 산 66-1,33.4609888,126.7617742
방림원,제주특별자치도 제주시 한경면 용금로 864,제주특별자치도 제주시 한경면 저지리 2120-91,33.3373026,126.2685273
방선문,제주특별자치도 제주시 종천길 39-1,제주특별자치도 제주시 오라이동 3322,33.4713430,126.5021716
방일리공원,제주특별자치도 제주시 정원로 50,제주특별자치도 제주시 노형동 3812-1,33.4792370,126.4771160
방주교회,제주특별자치도 서귀포시 안덕면 산록남로762번길 113,제주특별자치도 서귀포시 안덕면 상천리 427,33.3051190,126.3877847
배령연대,제주특별자치도 제주시 한림읍 금능리 1649,제주특별자치도 제주시 한림읍 금능리 1649,33.3879583,126.2237077
백년초농장박물관,제주특별자치도 서귀포시 태평로 200,제주특별자치도 서귀포시 호근동 310-3,33.2446745,126.5438916
백록담,제주특별자치도 서귀포시 토평동 산 15-1,제주특별자치도 서귀포시 토평동 산 15-1,33.3469130,126.5354225
백약이오름,제주특별자치도 서귀포시 표선면 성읍리 산 1,제주특별자치도 서귀포시 표선면 성읍리 산 1,33.4372159,126.7901630
백제사,제주시 애월읍 광령남6길 54 백제사,제주특별자치도 제주시 애월읍 광령리 4121,33.4489507,126.4242963
백제사 템플스테이,제주시 애월읍 광령남6길 54 백제사,제주특별자치도 제주시 애월읍 광령리 4121,33.4489507,126.4242963
백조일손지묘(백조일손지지),제주특별자치도 서귀포시 안덕면 사계리,제주특별자치도 서귀포시 안덕면 사계리,33.2095,126.3145
밸런싱 요가,제주특별자치도 제주시 중앙로 492,제주특별자치도 제주시 아라일동 2338-4,33.4792005,126.5433406
뱅듸승마클럽,제주특별자치도 제주시 조천읍 번영로 1118-33,제주특별자치도 제주시 조천읍 와흘리 산18,33.4666510,126.6534918
범서프,제주특별자치도 제주시 선사로8길 11,제주특별자치도 제주시 삼양일동 1569-25,33.5255281,126.5867504
범섬,제주특별자치도 서귀포시 법환동,제주특별자치도 서귀포시 법환동,33.242764,126.51065
법정사,제주특별자치도 서귀포시 1100로 740-168,제주특별자치도 서귀포시 도순동 산1,33.3098908,126.4743592
법화사,제주특별자치도 서귀포시 하원북로 35번길 15-28,제주특별자치도 서귀포시 하원동 1071-1,33.2653046,126.4575824
법화사지,제주특별자치도 서귀포시 하원북로35번길 15-28,제주특별자치도 서귀포시 하원동 1071-1,33.2653046,126.4575824
법환포구,제주특별자치도 서귀포시 막숙포로37번길 2,제주특별자치도 서귀포시 법환동 287-3,33.2378657,126.5157300
베릿네오름,제주특별자치도 서귀포시 중문상로17번길 51,제주특별자치도 서귀포시 중문동 2273,33.2489613,126.4190964
벨리타,제주특별자치도 제주시 조천읍 중산간동로 1194,제주특별자치도 제주시 조천읍 선흘리 2861-4,33.5080387,126.6978029
별내린전망대,제주특별자치도 서귀포시 색달동 2938-1,제주특별자치도 서귀포시 색달동 2938-1,33.2474909,126.4168140
별도봉,제주특별자치도 제주시 선반로 (화북일동),제주 제주시 화북일동 4472,,
별도연대,제주특별자치도 제주시 화북1동 1537,제주특별자치도 제주시 화북1동 1537,33.5262196,126.5680359
별도포구,제주특별자치도 제주시 화북1동 4269-12,제주특별자치도 제주시 화북1동 4269-12,33.5250000,126.5649107
별방진,제주특별자치도 제주시 구좌읍 하도리 3354,제주특별자치도 제주시 구좌읍 하도리 3354,33.5261673,126.8843610
병악현무암지대,제주특별자치도 서귀포시 안덕면 사계리,제주특별자치도 서귀포시 안덕면 사계리,33.2095,126.3145
보롬왓,제주특별자치도 서귀포시 표선면 번영로 2350-104,제주특별자치도 서귀포시 표선면 성읍리 3229-4,33.4134956,126.7524948
"보롬이(하논, 화구구)",제주특별자치도 서귀포시 하논로 (서홍동),제주 서귀포시 서홍동,,
보목포구,제주특별자치도 서귀포시 보목포로 46,제주특별자치도 서귀포시 보목동 566-3,33.2391906,126.6068197
보물섬하이킹,제주특별자치도 제주시 용문로14길 14,제주특별자치도 제주시 용담이동 2706-1,33.5060174,126.5102068
보통청춘기록실 청춘사진관,제주특별자치도 제주시 한림읍 귀덕11길 1,제주특별자치도 제주시 한림읍 귀덕리 1010-2,33.4439163,126.2935952
본초족욕,제주특별자치도 제주시 은수길 65,제주특별자치도 제주시 연동 1326,33.4716110,126.4877417
본태박물관,제주특별자치도 서귀포시 안덕면 산록남로762번길 69,제주특별자치도 서귀포시 안덕면 상천리 380,33.3038491,126.3921862
볼레낭길,제주특별자치도 서귀포시 안덕면 감산리 1049,제주특별자치도 서귀포시 안덕면 감산리 1049,33.2359162,126.3493751
봉구의간식,제주특별자치도 제주시 애월읍 애월로 110,제주특별자치도 제주시 애월읍 애월리 1576-1,33.4645215,126.3191042
봉글레산,제주특별자치도 제주시 추자면 대서5길 1,제주특별자치도 제주시 추자면 대서리 167,33.9617937,126.2937669
봉쥬르봉봉,제주특별자치도 제주시 한림읍 한림로 408-2,제주특별자치도 제주시 한림읍 협재리 1587,33.3978517,126.2455251
부대악오름,제주특별자치도 제주시 조천읍 선흘리 산 103,제주특별자치도 제주시 조천읍 선흘리 산 103,33.4473974,126.7094860
부영컨트리클럽,제주특별자치도 서귀포시 남원읍 남조로 960 부영CC,제주특별자치도 서귀포시 남원읍 수망리 628-8,33.3592183,126.7124642
북오름,제주특별자치도 서귀포시 안덕면 동광리 산 94,제주특별자치도 서귀포시 안덕면 동광리 산 94,33.3026811,126.3319998
북촌국민학교,제주특별자치도 제주시 조천읍 일주동로 1481,제주특별자치도 제주시 조천읍 북촌리 1212,33.5480083,126.6917211
북촌돌하르방미술관,제주특별자치도 제주시 조천읍 북촌서1길 70,제주특별자치도 제주시 조천읍 북촌리 976,33.5388536,126.6888142
북촌리 4.3길,제주특별자치도 제주시 조천읍 북촌3길 3,제주특별자치도 제주시 조천읍 북촌리 1599,33.5460288,126.6886490
북촌포구,제주특별자치도 제주시 조천읍 북촌9길 26-1,제주특별자치도 제주시 조천읍 북촌리 588,33.5500651,126.6940862
북촌환해장성,제주특별자치도 제주시 조천읍 북촌리,제주특별자치도 제주시 조천읍 북촌리,33.545242,126.697463
불카분낭 (불타버린 나무),제주특별자치도 제주시 조천읍 선흘리 1136-2,제주특별자치도 제주시 조천읍 선흘리 1136-2,33.5127254,126.7063251
불탑사 (5층석탑),제주특별자치도 제주시 원당로16길 41,제주특별자치도 제주시 삼양일동 697,33.5290714,126.5983403
붉은오름 자연휴양림,제주특별자치도 서귀포시 표선면 남조로 1487-73,제주특별자치도 서귀포시 표선면 가시리 산158,33.4014447,126.6757628
붉은오름(성산읍),제주특별자치도 서귀포시 성산읍 섭지코지로 261,제주특별자치도 서귀포시 성산읍 고성리 57,33.4258209,126.9313668
붉은오름(표선면),제주특별자치도 서귀포시 표선면 남조로 1487-73,제주특별자치도 서귀포시 표선면 가시리 산158,33.4014447,126.6757628
뷰 제주하늘,제주특별자치도 서귀포시 성산읍 서성일로 397,제주특별자치도 서귀포시 성산읍 난산리 2815,33.4132240,126.8329620
브레이브독스,제주특별자치도 제주시 한림읍 한수풀로 138,제주특별자치도 제주시 한림읍 대림리 428-13,33.4216292,126.2766106
브리더스파크,제주특별자치도 제주시 구좌읍 금백조로 902-102,제주특별자치도 제주시 구좌읍 송당리 2463,33.4340778,126.7774154
브릭캠퍼스,제주특별자치도 제주시 1100로 3047,제주특별자치도 제주시 노형동 244-1,33.4585618,126.4853074
블루버블,제주특별자치도 서귀포시 성산읍 일출로255번길 11,제주특별자치도 서귀포시 성산읍 성산리 175-3,33.4622831,126.9331224
비고르서프,제주특별자치도 서귀포시 안덕면 형제해안로 70,제주특별자치도 서귀포시 안덕면 사계리 2294-20,33.2258392,126.2998174
비블리아성서식물원,제주특별자치도 제주시 한림읍 조성로 17,제주특별자치도 제주시 한림읍 상명리 1191-5,33.3561963,126.2749933
비양도,제주특별자치도 제주시 한림읍 협재리,제주특별자치도 제주시 한림읍 협재리,33.3822,126.2498
비양도 연평리 야영지,제주특별자치도 제주시 우도면 연평리 3,제주특별자치도 제주시 우도면 연평리 3,33.5153728,126.9684364
비양도등대,제주특별자치도 제주시 한림읍 비양도길 84비양도,제주특별자치도 제주시 한림읍 협재리 2932-2,33.4059351,126.2228841
비양도의 비양나무자생지,제주특별자치도 제주시 한림읍 협재리 산 89,제주특별자치도 제주시 한림읍 협재리 산 89,33.4086702,126.2258658
비자림,제주특별자치도 제주시 구좌읍 비자숲길 55,제주특별자치도 제주시 구좌읍 평대리 3161-1,33.4910986,126.8114581
비자림농원,제주특별자치도 제주시 조천읍 선흘동1길 31-71,제주특별자치도 제주시 조천읍 선흘리 2740,33.5153896,126.6965185
비체올린,제주특별자치도 제주시 한경면 판조로 253-6,제주특별자치도 제주시 한경면 판포리 725-1,33.3494278,126.2182291
비치미오름,제주특별자치도 제주시 구좌읍 송당리 산 255-1,제주특별자치도 제주시 구좌읍 송당리 산 255-1,33.4286726,126.7664584
빌레못동굴,제주특별자치도 제주시 애월읍 어음리 1391,제주특별자치도 제주시 애월읍 어음리 1391,33.4043218,126.3497043
빛의 벙커,제주특별자치도 서귀포시 성산읍 고성리  2039-22,제주특별자치도 서귀포시 성산읍 고성리  2039-22,33.4396070,126.8998358
빠우사,제주특별자치도 제주시 조천읍 선교로 539,제주특별자치도 제주시 조천읍 선흘리 472-5,33.4577401,126.7119091
뽀로로&타요 테마파크 제주,제주특별자치도 서귀포시 안덕면 병악로 269,제주특별자치도 서귀포시 안덕면 상창리 79,33.3004603,126.3708042
쁘램 요가,제주특별자치도 제주시 연북로 88,제주특별자치도 제주시 연동 1372-3,33.4815156,126.4906280
삐삐그루밍,제주특별자치도 서귀포시 대정읍 중산간서로 2269,제주특별자치도 서귀포시 대정읍 구억리 835-1,33.2806352,126.2860625
사계 용머리해안 (해산물),제주특별자치도 서귀포시 안덕면 사계남로216번길 28,제주특별자치도 서귀포시 안덕면 사계리 118-3,33.2337928,126.3108416
사계항,제주특별자치도 서귀포시 안덕면 사계리,제주특별자치도 서귀포시 안덕면 사계리,33.2095,126.3145
사계해변,제주특별자치도 서귀포시 안덕면 사계리 2147-35,제주특별자치도 서귀포시 안덕면 사계리 2147-35,33.2281569,126.3083305
사계해안도로,제주특별자치도 서귀포시 안덕면 사계리,제주특별자치도 서귀포시 안덕면 사계리,33.2095,126.3145
사라봉,제주특별자치도 제주시 사라봉동길 61,제주특별자치도 제주시 건입동 388,33.5175968,126.5461398
사라봉공원,제주특별자치도 제주시 사라봉동길 74 (건입동),제주특별자치도 제주시 건입동 387-1,33.5186634,126.5476899
사라오름,제주특별자치도 서귀포시 남원읍 신례리 산 2-1,제주특별자치도 서귀포시 남원읍 신례리 산 2-1,33.3642265,126.6050291
사려니숲길,제주특별자치도 제주시 조천읍 교래리 산 137-1,제주특별자치도 제주시 조천읍 교래리 산 137-1,33.4077504,126.6424787
사려니오름,제주특별자치도 서귀포시 남원읍 516로 1648-87,제주특별자치도 서귀포시 남원읍 한남리 산2-1,33.3688512,126.6339831
사슴공방,제주특별자치도 제주시 구좌읍 구좌로 51 3층,제주특별자치도 제주시 구좌읍 세화리 1465-15,33.5232262,126.8570013
사진놀이터,제주특별자치도 제주시 애월읍 평화로 2835,제주특별자치도 제주시 애월읍 광령리 100-3,33.4565873,126.4414265
삭제요청 2,제주특별자치도 서귀포시 대정읍 중산간서로 2260-15,제주특별자치도 서귀포시 대정읍 구억리 654-1,33.2825442,126.2873438
삭제요청 3,제주특별자치도 제주시 애월읍 어음13길 196,제주특별자치도 제주시 애월읍 어음리 49,33.3954627,126.3608172
산굼부리,제주특별자치도 제주시 조천읍 비자림로 768,제주특별자치도 제주시 조천읍 교래리 342-2,33.4342180,126.6887630
산도스카발리오홀스파크,제주특별자치도 서귀포시 안덕면 산록남로 566,제주특별자치도 서귀포시 안덕면 광평리 268,33.3335198,126.3700302
산방굴사,제주특별자치도 서귀포시 안덕면 사계리 산 16,제주특별자치도 서귀포시 안덕면 사계리 산 16,33.2423871,126.3139465
산방산,제주특별자치도 서귀포시 안덕면 사계리 산 16,제주특별자치도 서귀포시 안덕면 사계리 산 16,33.2423871,126.3139465
산방산 랜드,제주특별자치도 서귀포시 안덕면 사계남로216번길 24-32,제주특별자치도 서귀포시 안덕면 사계리 116-6,33.2333682,126.3132933
산방산 수국,제주특별자치도 서귀포시 안덕면 산방로,제주특별자치도 서귀포시 안덕면 사계리 산 16,,
산방산 용머리해안 지질트레일,제주특별자치도 서귀포시 안덕면 사계북로41번길 192,제주특별자치도 서귀포시 안덕면 사계리 981,33.2490188,126.2988035
산방산둘레길,제주 서귀포시 안덕면 감산리,제주 서귀포시 안덕면 감산리,33.2493,126.3511
산방산탄산온천,제주특별자치도 서귀포시 안덕면 사계북로 41번길 192,제주특별자치도 서귀포시 안덕면 사계리 981,33.2490188,126.2988035
산양곶자왈,제주특별자치도제주시 한경면 청수리 956-6,명제주특별자치도 제주시 한경면 연명로 179,33.2909370,126.2506774
산지등대,제주특별자치도 제주시 사라봉동길 108-1 (건입동),제주특별자치도 제주시 건입동 340-2,33.5213877,126.5457939
산지천,제주특별자치도 제주시 건입동,제주특별자치도 제주시 건입동,33.515029,126.531543
산지천갤러리,제주특별자치도 제주시 중앙로3길 36,제주특별자치도 제주시 일도일동 1247,33.5151433,126.5283238
산지항 옛터,제주특별자치도 제주시 연무정길 28 (건입동)일대,제주특별자치도 제주시 건입동 940-3,33.5166672,126.5355253
산천단,제주특별자치도 제주시 아라1동 392-3,명제주특별자치도 제주시 516로 3041-29,33.4478030,126.5529468
산천단곰솔,제주특별자치도 제주시 516로 3041-24,제주특별자치도 제주시 아라일동 375-1,33.4476478,126.5546965
산호레저,제주특별자치도 제주시 우도면 우도해안길 73,제주특별자치도 제주시 우도면 연평리 1737-14,33.4930279,126.9510099
삼각봉,제주특별자치도 제주시 1100로 2070-61,제주특별자치도 제주시 해안동 산220-13,33.3926876,126.4948419
삼다수목장,제주특별자치도 제주시 조천읍 비자림로 485-15,제주특별자치도 제주시 조천읍 교래리 산119-1,33.4298273,126.6587312
삼다수숲길 지질트레일,제주특별자치도 제주시 조천읍 교래3길 98,제주특별자치도 제주시 조천읍 교래리 606-1,33.4317013,126.6746250
삼매봉,제주특별자치도 서귀포시 남성로115번길 83,제주특별자치도 서귀포시 서홍동 819,33.2438741,126.5463538
삼밭구석 & 동광리4·3희생자위령비,제주특별자치도 서귀포시 안덕면 동광리 1425 일대,제주특별자치도 서귀포시 안덕면 동광리 1425 일대,33.3112550,126.3303665
삼사석,제주특별자치도 제주시 화북1동 1380-1,제주특별자치도 제주시 화북1동 1380-1,33.5210499,126.5739829
삼성혈,제주특별자치도 제주시 삼성로 22,제주특별자치도 제주시 이도일동 1313,33.5042895,126.5291615
삼양 셋다리물,제주특별자치도 제주시 삼양1동 1938-9,제주특별자치도 제주시 삼양1동 1938-9,33.5289363,126.5891514
삼양방파제,제주특별자치도 제주시 벌랑길,제주특별자치도 제주시 벌랑길,,
삼양해수욕장,제주특별자치도 제주시 삼양동,제주특별자치도 제주시 삼양동,33.521802,126.585464
삼양해안도로,제주특별자치도 제주시 삼양2동,제주특별자치도 제주시 삼양2동,33.5213,126.584725
삼의악트레킹코스,제주특별자치도 제주시 아라동 산 24-2,제주특별자치도 제주시 아라동 산 24-2,33.4395097,126.5618996
삼화포구,제주특별자치도 제주시 서흘1길 26,제주특별자치도 제주시 삼양일동 1775,33.5287323,126.5891148
상추자마을길,제주특별자치도 제주시 추자도 추자면,제주특별자치도 제주시 추자도 추자면,,
상추자포구,제주특별자치도 제주시 추자면 대서리,제주특별자치도 제주시 추자면 대서리,34.00952,126.340034
상추자항,제주특별자치도 제주시 추자면 추자로 39,제주특별자치도 제주시 추자면 대서리 147-5,33.9624114,126.2953182
상효원,제주특별자치도 서귀포시 산록남로 2847-37,제주특별자치도 서귀포시 상효동 산25,33.3072168,126.5860085
새별오름,제주특별자치도 제주시 애월읍 봉성리 산 59-8,제주특별자치도 제주시 애월읍 봉성리 산 59-8,33.3673209,126.3570070
새별헤이요목장,제주도 제주시 애월읍 봉성리 4554-20,제주도 제주시 애월읍 봉성리 4554-20,33.3622195,126.3630096
새섬,제주특별자치도 서귀포시 남성중로 40,제주특별자치도 서귀포시 서홍동 707-5,33.2392101,126.5584133
새시물,제주특별자치도 제주시 한림읍 상한로,제주특별자치도 제주시 한림읍 상명리,,
새연교,제주특별자치도 서귀포시 서홍동 707-4,제주특별자치도 서귀포시 서홍동 707-4,33.2385071,126.5588566
샘이오름,제주특별자치도 제주시 조천읍 516로,제주 제주시 구좌읍 송당리 산145,,
생각하는정원,제주특별자치도 제주시 한경면 녹차분재로 675,제주특별자치도 제주시 한경면 저지리 1534,33.3253181,126.2548493
생이기정,제주특별자치도 제주시 한경면 용수리 산 60,제주특별자치도 제주시 한경면 용수리 산 60,33.3156157,126.1672722
샤이니숲길,제주특별자치도 제주시 조천읍 교래리 719-10,제주특별자치도 제주시 조천읍 교래리 719-10,33.4272799,126.6617098
서건도,제주특별자치도 서귀포시 강정동 산 1,제주특별자치도 서귀포시 강정동 산 1,33.2300511,126.4984720
서광리 곶자왈생태탐방로,제주특별자치도 서귀포시 안덕면 서광리 산6-1,제주특별자치도 서귀포시 안덕면 서광리 산6-1,33.2851325,126.3379577
서광승마장,제주특별자치도 서귀포시 안덕면 녹차분재로 239,제주특별자치도 서귀포시 안덕면 서광리 산50-33,33.3024627,126.2908530
서귀다원,제주특별자치도 서귀포시 상효동 산 118,제주특별자치도 서귀포시 상효동 산 118,33.3128258,126.5964482
서귀본향당,제주특별자치도 서귀포시 이중섭로 23-11,제주특별자치도 서귀포시 서귀동 534-2,33.2463193,126.5647247
서귀포 궁도장(천지정),제주특별자치도 서귀포시 중산간서로 97-40,제주특별자치도 서귀포시 강정동 1475,33.2592282,126.4979741
서귀포 다이브센터,제주특별자치도 서귀포시 남원읍 하례망장포로 65-13 2층,제주특별자치도 서귀포시 남원읍 하례리 64-10,33.2592530,126.6394300
서귀포 하영올레,제주특별자치도 서귀포시 중앙로 105,제주특별자치도 서귀포시 서홍동 440-1,33.2539250,126.5597875
서귀포농업기술센터 제주농업생태원,제주특별자치도 서귀포시 남원읍 중산간동로 7413,제주특별자치도 서귀포시 남원읍 하례리 1558,33.2883077,126.6072409
서귀포시립기당미술관,제주특별자치도 서귀포시 남성중로153번길 15,제주특별자치도 서귀포시 서홍동 621,33.2448480,126.5511787
서귀포예술의전당,제주특별자치도 서귀포시 태평로 270,제주특별자치도 서귀포시 서홍동 551-1,33.2463334,126.5507911
서귀포의료원,제주특별자치도 서귀포시 장수로 47,제주특별자치도 서귀포시 동홍동 1530-2,33.2555355,126.5639216
서귀포자연휴양림,제주특별자치도 서귀포시 1100로 882,제주특별자치도 서귀포시 대포동 산1-8,33.3115019,126.4587547
서귀포잠수함(대국해저관광),"제주특별자치도 서귀포시 남성중로 40 (서홍동, 유람선매표소) 서귀포잠수함",제주특별자치도 서귀포시 서홍동 707-5,33.2392101,126.5584133
