AREA_NM,New_ADDR,Old_ADDR,lat,lng
액트(AC.lll.T) 볼링장,제주특별자치도 서귀포시 안덕면 신화역사로304번길 98,제주특별자치도 서귀포시 안덕면 서광리 산35-16,33.3065312,126.3075431
액티브파크,제주특별자치도 제주시 한림읍 금능남로 76,제주특별자치도 제주시 한림읍 금능리 2225,33.3811520,126.2360825
약천사,제주특별자치도 서귀포시 이어도로 293-28,제주특별자치도 서귀포시 대포동 1161,33.2452785,126.4501816
약천사 템플스테이,제주특별자치도 서귀포시 이어도로 293-28 (대포동),제주특별자치도 서귀포시 대포동 1161,33.2452785,126.4501816
어리목계곡,제주특별자치도 제주시 1100로 2070-61,제주특별자치도 제주시 해안동 산220-13,33.3926876,126.4948419
어린이교통공원,제주특별자치도 제주시 명림로 437 (봉개동 4.3 공원 맞은편),제주특별자치도 제주시 봉개동 237-18,33.4514813,126.6233515
어승생,제주특별자치도 제주시 해안동 1100도로 555번지 (해안동 산220-12번지),명제주특별자치도 제주시 해안마을7다길 9,33.4569763,126.4586365
어영공원,제주특별자치도 제주시 서해안로 452 (맞은편 공원),제주특별자치도 제주시 용담삼동 2396,33.5177090,126.4877674
엄바위장승,제주특별자치도 제주시 추자면 예초리 332,제주특별자치도 제주시 추자면 예초리 332,33.9524967,126.3289102
엉덩물계곡,제주특별자치도 서귀포시 중문관광로 192,제주특별자치도 서귀포시 중문동 2785-2,33.2432311,126.4190029
엉또폭포,제주특별자치도 서귀포시 염돈로 121-8 (강정동),제주특별자치도 서귀포시 강정동 5628,33.2588204,126.4919225
엉알해안,제주특별자치도 제주시 한경면 고산리 3427-33,제주특별자치도 제주시 한경면 고산리 3427-33,33.2988265,126.1685774
엉알해안산책로,제주특별자치도 제주시 한경면 노을해안로 1143,제주특별자치도 제주시 한경면 고산리 3616-10,33.3079512,126.1639761
에버리스 골프리조트,제주특별자치도 제주시 애월읍 평화로 1693-75,제주특별자치도 제주시 애월읍 어음리 523-22,33.3693256,126.3654286
에코랜드 테마파크,제주특별자치도 제주시 조천읍 번영로 1278-169,제주특별자치도 제주시 조천읍 대흘리 1221-1,33.4553485,126.6688528
에코승마아카데미,제주특별자치도 제주시 조천읍 비자림로 1065,제주특별자치도 제주시 조천읍 교래리 39-3,33.4345495,126.7186785
에코승마아카데미(구.제주승마장),제주특별자치도 제주시 조천읍 교래리 39-3번지 (비자림로 1065),명제주특별자치도 제주시 조천읍 비자림로 1065,33.4343413,126.7181304
여미지식물원,제주특별자치도 서귀포시 중문관광로 93,제주특별자치도 서귀포시 색달동 2484-1,33.2526510,126.4142190
연대포구,제주특별자치도 제주시 외도2동,제주특별자치도 제주시 외도2동,33.493306,126.428835
연미마을(오라리 방화사건 현장),제주특별자치도 제주시 연사길 142,제주특별자치도 제주시 오라이동 3030-1,33.4868096,126.5053000
연북정,제주특별자치도 제주시 조천읍 조천리 2690,제주특별자치도 제주시 조천읍 조천리 2690,33.5401943,126.6359441
연화못,제주특별자치도 제주시 애월읍 고하상로,제주 제주시 애월읍 하가리,,
열리해안길,제주특별자치도 서귀포시 하예동,제주특별자치도 서귀포시 하예동,33.2394,126.3804
영남동,제주특별자치도 서귀포시 산록남로 1966-34,제주특별자치도 서귀포시 영남동 224,33.2887775,126.4961204
영등할망 신화공원,제주 제주시 한림읍 귀덕11길 19,제주특별자치도 제주시 한림읍 귀덕리 989-2,33.4452141,126.2944511
영모원,제주특별자치도 제주시 애월읍 하귀리 1130-1,제주특별자치도 제주시 애월읍 하귀리 1130-1,,
영실기암,제주특별자치도 서귀포시 하원동,제주특별자치도 서귀포시 하원동,33.3003,126.4652
영주산,제주특별자치도 서귀포시 표선면 번영로,제주특별자치도 서귀포시 표선면,,
영천악(영천오름),제주특별자치도 서귀포시 516로 652,제주특별자치도 서귀포시 상효동 1154-11,33.3082896,126.5994086
예래생태체험관,제주특별자치도 서귀포시 예래로 213,제주특별자치도 서귀포시 하예동 24-1,33.2444220,126.3909498
예래해안도로,제주특별자치도 서귀포시 예래해안로,제주특별자치도 서귀포시 하예동,,
예술공간 이아,제주특별자치도 제주시 중앙로14길 21,제주특별자치도 제주시 삼도이동 154,33.5108211,126.5219533
예절이오름(여절악),제주특별자치도 서귀포시 남원읍 신흥리 산 18,제주특별자치도 서귀포시 남원읍 신흥리 산 18,33.3483237,126.7358510
예초리,제주특별자치도 제주시 추자도 예초리,제주특별자치도 제주시 추자도 예초리,,
예초리기정길,제주특별자치도 제주시 추자면 예초리 산 1,제주특별자치도 제주시 추자면 예초리 산 1,33.9556868,126.3379665
예초리포구,제주특별자치도 제주시 추자면 추자로 753,제주특별자치도 제주시 추자면 예초리 200-1,33.9557058,126.3322813
예초리해변,제주특별자치도 제주시 추자면 예초리,제주특별자치도 제주시 추자면 예초리,33.952417,126.334282
오라동 청보리-메밀꽃밭,제주특별자치도 제주시 오라2동 산 76,제주특별자치도 제주시 오라2동 산 76,33.4271365,126.5057721
오래물,제주특별자치도 제주시 도공로 2,제주특별자치도 제주시 도두일동 2614-5,33.5061379,126.4649906
오름터 민속마을,제주특별자치도 서귀포시 표선면 성읍정의현로 99,제주특별자치도 서귀포시 표선면 성읍리 599-1,33.3914911,126.8006314
오림반,제주특별자치도 서귀포시 남원읍 신례리,제주특별자치도 서귀포시 남원읍 신례리,33.339574,126.617913
오멍가멍 애견카페&호텔,제주특별자치도 제주시 어영길 64-14,제주특별자치도 제주시 용담삼동 1206,33.5174358,126.4981984
오백나한,제주특별자치도 서귀포시 영실로 245 (하원동),제주특별자치도 서귀포시 하원동 산1-1,33.3403916,126.4808196
오설록티뮤지엄,제주특별자치도 서귀포시 안덕면 신화역사로 15,제주특별자치도 서귀포시 안덕면 서광리 1235-1,33.3060844,126.2893927
오조포구,제주특별자치도 서귀포시 성산읍 오조리,제주특별자치도 서귀포시 성산읍 오조리,33.461268,126.904488
오페라 옴니아 : 라파엘로展,제주특별자치도 서귀포시 안덕면 녹차분재로 218,제주특별자치도 서귀포시 안덕면 서광리 산39,33.3043418,126.2996189
오현단,제주특별자치도 제주시 오현길 61,제주특별자치도 제주시 이도일동 1421-34,33.5103090,126.5255377
옥돔마을,제주특별자치도 서귀포시 남원읍 남태해안로 508,제주특별자치도 서귀포시 남원읍 태흥리 364-4,33.2870051,126.7494482
온평리 포구,제주특별자치도 서귀포시 성산읍 온평리,제주특별자치도 서귀포시 성산읍 온평리,33.409,126.8926
온평리 환해장성,제주특별자치도 서귀포시 성산읍 환해장성로 732,제주특별자치도 서귀포시 성산읍 온평리 65,33.4180024,126.9103599
올레바당체험마을,제주특별자치도 제주시 한림읍 한림해안로 267-6,제주특별자치도 제주시 한림읍 수원리 724-4,33.4254663,126.2641180
올레여행자센터,제주특별자치도 서귀포시 중정로 22,제주특별자치도 서귀포시 서귀동 316-1,33.2474052,126.5586670
올레캠프 본점 알파캠프,제주특별자치도 서귀포시 성산읍 고성오조로 106,제주특별자치도 서귀포시 성산읍 고성리 1207-2,33.4530008,126.9140232
옷귀마테마타운,제주특별자치도 서귀포시 남원읍 서성로 955-117,제주특별자치도 서귀포시 남원읍 한남리 1631-1,33.3404485,126.6834324
옹포천,제주특별자치도 제주시 한림읍 한림로 563,제주특별자치도 제주시 한림읍 옹포리 404,33.4075427,126.2572717
옹포포구,제주특별자치도 제주시 한림읍 옹포리,제주특별자치도 제주시 한림읍 옹포리,33.399048,126.251608
와흘본향당,제주특별자치도 제주시 조천읍 와흘리 1274-1,제주특별자치도 제주시 조천읍 와흘리 1274-1,33.5022985,126.6389991
왈종미술관,제주특별자치도 서귀포시 칠십리로214번길 30,제주특별자치도 서귀포시 동홍동 281-2,33.2452893,126.5736655
왕이메오름,제주특별자치도 서귀포시 안덕면 광평리 산 79,제주특별자치도 서귀포시 안덕면 광평리 산 79,33.3409746,126.3751506
외돌개,제주특별자치도 서귀포시 서홍동 791,제주특별자치도 서귀포시 서홍동 791,33.2400367,126.5456420
요가느림원,제주특별자치도 제주시 원노형2길 33,제주특별자치도 제주시 노형동 922-6,33.4832809,126.4816496
요기개,제주특별자치도 제주시 오남로 280,제주특별자치도 제주시 오라이동 843-5,33.4712460,126.5133122
요람,제주특별자치도 서귀포시 검은여로129번길 13,제주특별자치도 서귀포시 토평동 759-1,33.2532424,126.5830927
용눈이오름,제주특별자치도 제주시 구좌읍 종달리 산28,제주특별자치도 제주시 구좌읍 종달리 산28,33.4612044,126.8335266
용담 1동 벽화거리,제주특별자치도 제주시 서문로5길 1,제주특별자치도 제주시 용담일동 130-6,33.5117645,126.5170157
용담/용두암 해안도로,제주특별자치도 제주시 서해안로 687-8,제주특별자치도 제주시 용담이동 488-9,33.5155559,126.5121031
용담레포츠공원,제주특별자치도 제주시 서해안로 580,제주특별자치도 제주시 용담삼동 1089,33.5182372,126.4994427
용두암,제주특별자치도 제주시 용두암길 15,제주특별자치도 제주시 용담이동 483,33.5148920,126.5114000
용두암해안도로카페거리,제주특별자치도 제주시 용담3동,제주특별자치도 제주시 용담3동,33.516513,126.496333
용둠범목제계단길,제주특별자치도 제주시 추자면 영흥리,제주특별자치도 제주시 추자면 영흥리,33.9569,126.2964
용머리해안,제주특별자치도 서귀포시 안덕면 사계리 112-3,제주특별자치도 서귀포시 안덕면 사계리 112-3,33.2334804,126.3146170
용수항,제주특별자치도 제주시 한경면 용수리,제주특별자치도 제주시 한경면 용수리,33.3241,126.183
용연,제주특별자치도 제주시 흥운길 73,제주특별자치도 제주시 용담이동 454-1,33.5151923,126.5139762
용연카누클럽,제주특별자치도 제주시 용담2동 438,명제주특별자치도 제주시 흥운길 79,33.5155937,126.5139796
우도 득성이코지,제주특별자치도 제주시 우도면 연평리,제주특별자치도 제주시 우도면 연평리,33.5075,126.9549
우도 봉수대,제주특별자치도 제주시 우도면 연평리 798,제주특별자치도 제주시 우도면 연평리 798,33.5245738,126.9525447
우도 비양도,제주특별자치도 제주시 우도면 연평리,제주특별자치도 제주시 우도면 연평리,33.5075,126.9549
우도(해양도립공원),제주특별자치도 제주시 우도면 삼양고수물길 1,제주특별자치도 제주시 우도면 연평리 904-1,33.5194929,126.9510302
우도등대,제주특별자치도 제주시 우도면 우도봉길 105,제주특별자치도 제주시 우도면 연평리 337,33.4929803,126.9651427
우도봉 ATV,제주특별자치도 제주시 우도면 우도봉길 47,제주특별자치도 제주시 우도면 연평리 343-2,33.4935481,126.9596677
우도봉 풍경,제주특별자치도 제주시 우도면 연평리 1,제주특별자치도 제주시 우도면 연평리 1,33.5150148,126.9691736
우도산호해변 홍조단괴 서빈백사,제주특별자치도 제주시 우도면 우도해안길 252,제주특별자치도 제주시 우도면 연평리 2516-2,33.5026516,126.9437398
우도스쿠터여행,제주특별자치도 제주시 우도면 2395-5,제주특별자치도 제주시 우도면 2395-5,,
우도올레보트,제주특별자치도 제주시 우도면 연평리 2562-1,제주특별자치도 제주시 우도면 연평리 2562-1,33.5016586,126.9445583
우도잠수함(제주씨월드),제주특별자치도 서귀포시 성산읍 성산등용로 130-21,제주특별자치도 서귀포시 성산읍 성산리 347-9,33.4729280,126.9345062
우도징기스칸승마체험,제주특별자치도 제주시 우도면 우도해안길 446,제주특별자치도 제주시 우도면 연평리 988-1,33.5148701,126.9495505
우포토 시네마 갤러리 카페,제주특별자치도 서귀포시 대정읍 상모로 216-2,제주특별자치도 서귀포시 대정읍 상모리 2625-5,33.2253254,126.2659337
"웃밤(웃바매기,웃밤오름)",제주특별자치도 제주시 조천읍 선흘리 산 84,제주특별자치도 제주시 조천읍 선흘리 산 84,33.4781773,126.7142381
웃세오름(누운오름),제주특별자치도 제주시 애월읍 1100로 1579-25,제주특별자치도 제주시 애월읍 광령리 산183-4,33.3598302,126.4606868
웃세오름(족은오름),제주특별자치도 제주시 애월읍 평화로,제주특별자치도 제주시 애월읍 광령리 ,,
원당봉,제주특별자치도 제주시 원당로16길 16-30,제주특별자치도 제주시 삼양일동 산1-2,33.5260044,126.5982215
원동,제주특별자치도 제주시 애월읍 소길리 1364 일대,제주특별자치도 제주시 애월읍 소길리 1364 일대,33.4004819,126.3802942
원앙카라반캠핑장앤야영장,제주특별자치도 서귀포시 돈내코로 120,제주특별자치도 서귀포시 상효동 1460-3,33.3001307,126.5844363
원앙폭포,제주특별자치도 서귀포시 돈내코로 137,제주특별자치도 서귀포시 상효동 1463,33.3004966,126.5820043
월나봉(도래오름),제주특별자치도 서귀포시 안덕면 감산리 1148 일대,제주특별자치도 서귀포시 안덕면 감산리 1148 일대,33.2443911,126.3498417
월대천,제주특별자치도 제주시 월대6길 5,제주특별자치도 제주시 외도이동 232-1,33.4935132,126.4359776
월라봉 진지동굴 (안덕면),제주 서귀포시 안덕면 감산리,제주 서귀포시 안덕면 감산리,33.2493,126.3511
월라봉(효돈),제주특별자치도 서귀포시 월라봉로 76-40,제주특별자치도 서귀포시 신효동 산1,33.2705119,126.6045655
월라사,제주특별자치도 서귀포시 효돈순환로 415,제주특별자치도 서귀포시 신효동 579-2,33.2690434,126.6098556
월령선인장군락지,제주특별자치도 제주시 한림읍 월령리 359-4,제주특별자치도 제주시 한림읍 월령리 359-4,33.3778730,126.2154218
월령포구,제주특별자치도 제주시 한림읍 월평리,제주특별자치도 제주시 한림읍 월평리,,
월정 투명카약,제주특별자치도 제주시 구좌읍 월정리 1400-33,제주특별자치도 제주시 구좌읍 월정리 1400-33,33.5638491,126.7786252
월정리해변,제주특별자치도 제주시 구좌읍 월정리 33-3,명제주특별자치도 제주시 구좌읍 해맞이해안로 485,33.5551082,126.7986579
월정리해안도로,제주특별자치도 제주시 구좌읍 월정리 652-4,제주특별자치도 제주시 구좌읍 월정리 652-4,33.5565816,126.7949115
월평포구,제주특별자치도 서귀포시 말질로 462,제주특별자치도 서귀포시 월평동 665,33.2344782,126.4637821
위미리 동백나무군락,제주특별자치도 서귀포시 남원읍 위미중앙로300번길 23-7,제주특별자치도 서귀포시 남원읍 위미리 906-4,33.2727065,126.6760299
위미항,제주특별자치도 서귀포시 남원읍 위미중앙로196번길 6-13,제주특별자치도 서귀포시 남원읍 위미리 1757-12,33.2712755,126.6623803
윈드1947 카트 테마파크,제주특별자치도 서귀포시 토평공단로 78-27,제주특별자치도 서귀포시 토평동 1799,33.2895305,126.5888307
윗세오름(웃세오름),제주특별자치도 제주시 애월읍 광령리 산 183-1,제주특별자치도 제주시 애월읍 광령리 산 183-1,33.3708542,126.4777150
유건에오름,제주특별자치도 서귀포시 성산읍 난산리 2302,제주특별자치도 서귀포시 성산읍 난산리 2302,33.4135141,126.8467811
유동룡미술관,제주특별자치도 제주시 한림읍 용금로 906-10,제주특별자치도 제주시 한림읍 월림리 115-161,33.3405832,126.2708202
유리멘탈 스튜디오,제주특별자치도 제주시 한경면 낙수로12길,제주특별자치도 제주시 한경면 조수리 1464-8,33.3343803,126.2268695
유민미술관,제주특별자치도 서귀포시 성산읍 고성리 21,제주특별자치도 서귀포시 성산읍 고성리 21,33.4289660,126.9321373
유진팡 열대과일농장,제주특별자치도 서귀포시 남원읍 원님로399번길 31-7,제주특별자치도 서귀포시 남원읍 신흥리 2177,33.3399265,126.7424986
유캠프,제주특별자치도 제주시 애조로 1216,제주특별자치도 제주시 오라이동 504,33.4611031,126.5109773
육시우영,제주특별자치도 제주시 애월읍 하가리,제주특별자치도 제주시 애월읍 하가리,33.45342,126.3542
율랜드 다이브센터,제주특별자치도 서귀포시 칠십리로 490,제주특별자치도 서귀포시 보목동 762-5,33.2415151,126.6030720
이니스프리제주하우스,제주특별자치도 서귀포시 안덕면 신화역사로 23,제주특별자치도 서귀포시 안덕면 서광리 1235-1,33.3067025,126.2908890
이덕구 산전,제주특별자치도 제주시 조천읍 516로 1865,제주특별자치도 제주시 조천읍 교래리 산137-24,33.3845019,126.6194078
이랜드뮤지엄,제주특별자치도 제주시 한림해안로 530,제주특별자치도 제주시 한림읍 귀덕리 3861,33.4358040,126.2744306
이로이로공방,제주특별자치도 제주시 구좌읍 하도7길 16-11,제주특별자치도 제주시 구좌읍 하도리 1249,33.5157180,126.8863518
이상한 나라의 앨리스,제주특별자치도 서귀포시 안덕면 중산간서로 1881,제주특별자치도 서귀포시 안덕면 서광리 717-3,33.2889424,126.3218182
이승이오름(이승악),제주특별자치도 서귀포시 남원읍 신례리 산 12-19,명제주특별자치도 서귀포시 남원읍 신례천로 267-110,33.3148415,126.6310593
이음새,제주특별자치도 서귀포시 남원읍 위미리 4137-1,제주특별자치도 서귀포시 남원읍 위미리 4137-1,33.2757769,126.6514153
이중섭거리,제주특별자치도 서귀포시 이중섭로 4-1 (서귀동),제주특별자치도 서귀포시 서귀동 370-21,33.2476100,126.5639941
이중섭거주지,제주특별자치도 서귀포시 이중섭로 29,제주특별자치도 서귀포시 서귀동 512-1,33.2455527,126.5643216
이중섭미술관,제주특별자치도 서귀포시 이중섭로 27-3,제주특별자치도 서귀포시 서귀동 532-1,33.2458617,126.5648745
이편한치과,제주특별자치도 제주시 연북로 527 반디빌딩 5층,제주특별자치도 제주시 아라일동 6035-1,33.4851842,126.5361543
이호-내도 해안도로,제주특별자치도 제주시 테우해안로 60,제주특별자치도 제주시 내도동 475,33.4961751,126.4412319
이호털보네배낚시,제주특별자치도 제주시 이호1동 1787,명제주특별자치도 제주시 테우해안로 146,33.4971719,126.4493453
이호테우말등대,제주특별자치도 제주시 서해안로 58,제주특별자치도 제주시 이호일동 374,33.5021616,126.4564169
이호테우해수욕장,제주특별자치도 제주시 도리로 20,제주특별자치도 제주시 이호이동 1600-1,33.4961783,126.4559012
익스트림제주 카약올레,제주시 애월읍 애월로1길 22,제주특별자치도 제주시 애월읍 애월리 2490-1,33.4623327,126.3104764
일출랜드,제주특별자치도 서귀포시 성산읍 중산간동로 4150-30,제주특별자치도 서귀포시 성산읍 삼달리 1010,33.3832875,126.8415364
일출랜드 아트센터,제주특별자치도 서귀포시 성산읍 중산간동로 4150-30,제주특별자치도 서귀포시 성산읍 삼달리 1010,33.3832875,126.8415364
임문숙 가족 헛묘,제주특별자치도 서귀포시 안덕면 동광리 807-4,제주특별자치도 서귀포시 안덕면 동광리 807-4,33.3090167,126.3405429
입산봉(삿갓오름),제주특별자치도 제주시 구좌읍 김녕리 1033-19,제주특별자치도 제주시 구좌읍 김녕리 1033-19,33.5490269,126.7555989
자구내포구,제주특별자치도 제주시 한경면 고산리,제주특별자치도 제주시 한경면 고산리,33.302744,126.181314
자구리공원,제주특별자치도 서귀포시 칠십리로 145,제주특별자치도 서귀포시 서귀동 70,33.2443818,126.5689264
자리왓,제주특별자치도 제주시 애월읍 봉성리 1410 일대,제주특별자치도 제주시 애월읍 봉성리 1410 일대,33.4043992,126.3277366
"자배봉(자배오름,망오름)",제주특별자치도 서귀포시 남원읍  위미리 산 132-1,제주특별자치도 서귀포시 남원읍  위미리 산 132-1,33.3015316,126.6759934
장생의 숲길,제주특별자치도 제주시 명림로 584,제주특별자치도 제주시 봉개동 산78-1,33.4400577,126.6251975
장전리 벚꽃축제길,제주특별자치도 제주시 애월읍 광상로 403,제주특별자치도 제주시 애월읍 장전리 628-3,33.4432753,126.3906051
저지 예술인 마을,제주특별자치도 제주시 한경면 저지14길 28-4,제주특별자치도 제주시 한경면 저지리 2120-116,33.3395130,126.2671183
"저지오름(닥몰오름,새오름)",제주특별자치도 제주시 한경면 저지리 산 51,제주특별자치도 제주시 한경면 저지리 산 51,33.3329925,126.2509324
전농로 서사라문화거리,제주특별자치도 제주시 서사로7길 27,제주특별자치도 제주시 삼도이동 1230-4,33.5065738,126.5223908
절물오름(큰대나),제주특별자치도 제주시 명림로 584 일대,제주특별자치도 제주시 봉개동 산78-1,33.4400577,126.6251975
절부암,제주특별자치도 제주시 한경면 용수3길 22,제주특별자치도 제주시 한경면 용수리 4241-1,33.3239349,126.1672002
점보빌리지,제주특별자치도 서귀포시 안덕면 평화로 319번길 31-11,제주특별자치도 서귀포시 안덕면 서광리 2351,33.2761911,126.3050869
정모시쉼터,제주특별자치도 서귀포시 부두로5번길 9,제주특별자치도 서귀포시 서귀동 57-4,33.2447060,126.5662068
정물오름,제주특별자치도 제주시 한림읍 금악리 산 52-1,제주특별자치도 제주시 한림읍 금악리 산 52-1,33.3379407,126.3298911
정방폭포,제주특별자치도 서귀포시 칠십리로214번길 37,제주특별자치도 서귀포시 동홍동 278,33.2447480,126.5730501
정의향교,제주특별자치도 서귀포시 표선면 성읍서문로 14,제주특별자치도 서귀포시 표선면 성읍리 820-1,33.3869918,126.7998025
정의현 일관헌,제주특별자치도 서귀포시 표선면 성읍리 690,제주특별자치도 서귀포시 표선면 성읍리 690,33.3882595,126.8009513
정주항,제주특별자치도 제주시 조천읍 함덕리,제주특별자치도 제주시 조천읍 함덕리,33.534575,126.66015
제라진 제주오프로드 사파리,제주특별자치도 제주시 조천읍 선교로 33,제주특별자치도 제주시 조천읍 선흘리 624-4,33.4871768,126.7159716
제라펫,제주특별자치도 제주시 용담로20길 28,제주특별자치도 제주시 용담일동 246-28,33.5078502,126.5134520
제로스테이션(제로포인트트레일),제주특별자치도 제주시 산지로 25 2층,제주특별자치도 제주시 건입동 1136,33.5147584,126.5292263
제스피 맥주협동조합 양조장,제주특별자치도 서귀포시 남원읍 서성로652번길 63-3,제주특별자치도 서귀포시 남원읍 한남리 산5-20,33.3233978,126.6717896
제원한의원,제주특별자치도 제주시 신대로14길 36 2층,제주특별자치도 제주시 연동 282-52,33.4879197,126.4927839
제이앤승마클럽,제주특별자치도 제주시 해안마을7길 211,제주특별자치도 제주시 해안동 351,33.4460970,126.4689836
제이홀스 승마클럽,제주특별자치도 제주시 월산남길 284,제주특별자치도 제주시 해안동 317-2,33.4499827,126.4719816
제주 더팔팔농장,제주특별자치도 서귀포시 성산읍 독자봉로60번길 20,제주특별자치도 서귀포시 성산읍 신산리 1371-1,33.3857010,126.8711545
제주 삼양동 유적,제주특별자치도 제주시 선사로2길 13 (삼양일동),제주특별자치도 제주시 삼양일동 1660-5,33.5233167,126.5877500
제주 이호털보 배낚시,제주시 테우해안로 146,제주특별자치도 제주시 이호일동 1787,33.4972078,126.4493536
제주 카카오캠핑,제주특별자치도 제주시 일주서로 7867,제주특별자치도 제주시 연동 1987,33.4940953,126.4872881
제주 토이 승마장,제주특별자치도 서귀포시 안덕면 동광로 265-14,제주특별자치도 서귀포시 안덕면 동광리 897-2,33.3182965,126.3451270
제주 패러글라이딩 스쿨,"제주특별자치도 제주시 신선길 17-6, 일도주택3층(일도2동)",제주특별자치도 제주시 일도이동 1029-139,33.5105103,126.5301624
